source,tag,division_code,division_name,section_code,section_name,cos,rank
openalex,Psychoanalysis and Psychopathology Research,88,Social work activities without accommodation,R,HUMAN HEALTH AND SOCIAL WORK ACTIVITIES,0.4390072226524353,1
openalex,UAV Applications and Optimization,61,Telecommunication,K,"TELECOMMUNICATION, COMPUTER PROGRAMMING, CONSULTING, COMPUTING INFRASTRUCTURE AND OTHER INFORMATION SERVICE ACTIVITIES",0.39706066250801086,1
openalex,Breast Lesions and Carcinomas,86,Human health activities,R,HUMAN HEALTH AND SOCIAL WORK ACTIVITIES,0.3709949254989624,1
openalex,Virology and Viral Diseases,75,Veterinary activities,N,"PROFESSIONAL, SCIENTIFIC AND TECHNICAL ACTIVITIES",0.4182495176792145,1
openalex,Enzyme-mediated dye degradation,13,Manufacture of textiles,C,MANUFACTURING,0.41892290115356445,1
openalex,Historical Philosophy and Science,72,Scientific research and development,N,"PROFESSIONAL, SCIENTIFIC AND TECHNICAL ACTIVITIES",0.3529498875141144,1
openalex,Historical Philosophy and Science,91,"Libraries, archives, museums and other cultural activities",S,"ARTS, SPORTS AND RECREATION",0.3476043939590454,2
openalex,Tribology and Lubrication Engineering,71,Architectural and engineering activities; technical testing and analysis,N,"PROFESSIONAL, SCIENTIFIC AND TECHNICAL ACTIVITIES",0.3538648188114166,1
openalex,Tribology and Lubrication Engineering,71,Architectural and engineering activities; technical testing and analysis,N,"PROFESSIONAL, SCIENTIFIC AND TECHNICAL ACTIVITIES",0.3538648188114166,2
openalex,Tribology and Lubrication Engineering,45,Trade and repair of motor vehicles and motorcycles,G,WHOLESALE AND RETAIL TRADE,0.3489258289337158,3
openalex,"Gout, Hyperuricemia, Uric Acid",86,Human health activities,R,HUMAN HEALTH AND SOCIAL WORK ACTIVITIES,0.2986999750137329,1
openalex,"Gout, Hyperuricemia, Uric Acid",87,Residential care activities,R,HUMAN HEALTH AND SOCIAL WORK ACTIVITIES,0.2972094416618347,2
openalex,Natural Antidiabetic Agents Studies,86,Human health activities,R,HUMAN HEALTH AND SOCIAL WORK ACTIVITIES,0.29217174649238586,1
openalex,Natural Antidiabetic Agents Studies,86,Human health activities,R,HUMAN HEALTH AND SOCIAL WORK ACTIVITIES,0.29217174649238586,2
openalex,Childhood Cancer Survivors' Quality of Life,88,Social work activities without accommodation,R,HUMAN HEALTH AND SOCIAL WORK ACTIVITIES,0.33365464210510254,1
openalex,Advanced Glycation End Products research,87,Residential care activities,R,HUMAN HEALTH AND SOCIAL WORK ACTIVITIES,0.2758517563343048,1
openalex,High Entropy Alloys Studies,24,Manufacture of basic metals,C,MANUFACTURING,0.39320558309555054,1
openalex,melanin and skin pigmentation,86,Human health activities,R,HUMAN HEALTH AND SOCIAL WORK ACTIVITIES,0.2593320608139038,1
openalex,Epoxy Resin Curing Processes,22,Manufacture of rubber and plastic products,C,MANUFACTURING,0.4659249782562256,1
openalex,Hormonal and reproductive studies,86,Human health activities,R,HUMAN HEALTH AND SOCIAL WORK ACTIVITIES,0.28415647149086,1
openalex,Misinformation and Its Impacts,73,"Activities of advertising, market research and public relations",N,"PROFESSIONAL, SCIENTIFIC AND TECHNICAL ACTIVITIES",0.384029746055603,1
openalex,"Language, Metaphor, and Cognition",85,Education,Q,EDUCATION,0.34000563621520996,1
openalex,Veterinary Oncology Research,75,Veterinary activities,N,"PROFESSIONAL, SCIENTIFIC AND TECHNICAL ACTIVITIES",0.41169387102127075,1
openalex,Endoplasmic Reticulum Stress and Disease,86,Human health activities,R,HUMAN HEALTH AND SOCIAL WORK ACTIVITIES,0.3208300471305847,1
openalex,Advanced Topology and Set Theory,72,Scientific research and development,N,"PROFESSIONAL, SCIENTIFIC AND TECHNICAL ACTIVITIES",0.3302043676376343,1
openalex,Advanced Topology and Set Theory,71,Architectural and engineering activities; technical testing and analysis,N,"PROFESSIONAL, SCIENTIFIC AND TECHNICAL ACTIVITIES",0.3207308351993561,2
openalex,Stochastic processes and statistical mechanics,72,Scientific research and development,N,"PROFESSIONAL, SCIENTIFIC AND TECHNICAL ACTIVITIES",0.35213348269462585,1
openalex,Stochastic processes and statistical mechanics,66,Activities auxiliary to financial services and insurance activities,L,FINANCIAL AND INSURANCE ACTIVITIES,0.34940019249916077,2
openalex,Stochastic processes and statistical mechanics,72,Scientific research and development,N,"PROFESSIONAL, SCIENTIFIC AND TECHNICAL ACTIVITIES",0.35213348269462585,3
openalex,Hernia repair and management,86,Human health activities,R,HUMAN HEALTH AND SOCIAL WORK ACTIVITIES,0.3598487377166748,1
openalex,Thermodynamic properties of mixtures,20,Manufacture of chemicals and chemical products,C,MANUFACTURING,0.4286959767341614,1
openalex,Advanced Optimization Algorithms Research,72,Scientific research and development,N,"PROFESSIONAL, SCIENTIFIC AND TECHNICAL ACTIVITIES",0.37476179003715515,1
openalex,Wireless Communication Security Techniques,61,Telecommunication,K,"TELECOMMUNICATION, COMPUTER PROGRAMMING, CONSULTING, COMPUTING INFRASTRUCTURE AND OTHER INFORMATION SERVICE ACTIVITIES",0.38790538907051086,1
openalex,Geological formations and processes,08,Other mining and quarrying,B,MINING AND QUARRYING,0.38253337144851685,1
openalex,Geological formations and processes,09,Mining support service activities,B,MINING AND QUARRYING,0.41552695631980896,2
openalex,Geological formations and processes,08,Other mining and quarrying,B,MINING AND QUARRYING,0.38253337144851685,3
openalex,Liver physiology and pathology,86,Human health activities,R,HUMAN HEALTH AND SOCIAL WORK ACTIVITIES,0.30082693696022034,1
openalex,Carbon Dioxide Capture Technologies,20,Manufacture of chemicals and chemical products,C,MANUFACTURING,0.41017457842826843,1
openalex,Carbon Dioxide Capture Technologies,39,Remediation activities and other waste management service activities,E,"WATER SUPPLY; SEWERAGE, WASTE MANAGEMENT AND REMEDIATION ACTIVITIES",0.41243070363998413,2
openalex,Statistical Distribution Estimation and Applications,65,"Insurance, reinsurance and pension funding, except compulsory social security",L,FINANCIAL AND INSURANCE ACTIVITIES,0.43522176146507263,1
openalex,Water resources management and optimization,36,"Water collection, treatment and supply",E,"WATER SUPPLY; SEWERAGE, WASTE MANAGEMENT AND REMEDIATION ACTIVITIES",0.4952903985977173,1
openalex,Team Dynamics and Performance,70,Activities of head offices and management consultancy,N,"PROFESSIONAL, SCIENTIFIC AND TECHNICAL ACTIVITIES",0.3508910834789276,1
openalex,Olfactory and Sensory Function Studies,86,Human health activities,R,HUMAN HEALTH AND SOCIAL WORK ACTIVITIES,0.39628443121910095,1
openalex,Power Systems Fault Detection,35,"Electricity, gas, steam and air conditioning supply",D,"ELECTRICITY, GAS, STEAM AND AIR CONDITIONING SUPPLY",0.4397369623184204,1
openalex,Power Systems Fault Detection,35,"Electricity, gas, steam and air conditioning supply",D,"ELECTRICITY, GAS, STEAM AND AIR CONDITIONING SUPPLY",0.4397369623184204,2
openalex,Radioactive element chemistry and processing,39,Remediation activities and other waste management service activities,E,"WATER SUPPLY; SEWERAGE, WASTE MANAGEMENT AND REMEDIATION ACTIVITIES",0.6220983862876892,1
openalex,Advanced Queuing Theory Analysis,70,Activities of head offices and management consultancy,N,"PROFESSIONAL, SCIENTIFIC AND TECHNICAL ACTIVITIES",0.38501566648483276,1
openalex,Bone Tumor Diagnosis and Treatments,86,Human health activities,R,HUMAN HEALTH AND SOCIAL WORK ACTIVITIES,0.3533909022808075,1
openalex,Viral gastroenteritis research and epidemiology,86,Human health activities,R,HUMAN HEALTH AND SOCIAL WORK ACTIVITIES,0.23212414979934692,1
openalex,Viral gastroenteritis research and epidemiology,86,Human health activities,R,HUMAN HEALTH AND SOCIAL WORK ACTIVITIES,0.23212414979934692,2
openalex,Optical Imaging and Spectroscopy Techniques,86,Human health activities,R,HUMAN HEALTH AND SOCIAL WORK ACTIVITIES,0.4110695421695709,1
openalex,Prenatal Screening and Diagnostics,72,Scientific research and development,N,"PROFESSIONAL, SCIENTIFIC AND TECHNICAL ACTIVITIES",0.33893218636512756,1
openalex,Breastfeeding Practices and Influences,86,Human health activities,R,HUMAN HEALTH AND SOCIAL WORK ACTIVITIES,0.2793855369091034,1
openalex,Breastfeeding Practices and Influences,87,Residential care activities,R,HUMAN HEALTH AND SOCIAL WORK ACTIVITIES,0.2930843234062195,2
openalex,Breastfeeding Practices and Influences,86,Human health activities,R,HUMAN HEALTH AND SOCIAL WORK ACTIVITIES,0.2793855369091034,3
openalex,Vascular Malformations and Hemangiomas,86,Human health activities,R,HUMAN HEALTH AND SOCIAL WORK ACTIVITIES,0.31184980273246765,1
openalex,Cytomegalovirus and herpesvirus research,86,Human health activities,R,HUMAN HEALTH AND SOCIAL WORK ACTIVITIES,0.28432905673980713,1
openalex,Motor Control and Adaptation,28,Manufacture of machinery and equipment n.e.c.,C,MANUFACTURING,0.4119272828102112,1
openalex,Aortic aneurysm repair treatments,86,Human health activities,R,HUMAN HEALTH AND SOCIAL WORK ACTIVITIES,0.2975328266620636,1
openalex,Sinusitis and nasal conditions,86,Human health activities,R,HUMAN HEALTH AND SOCIAL WORK ACTIVITIES,0.3478332757949829,1
openalex,Sleep and Wakefulness Research,72,Scientific research and development,N,"PROFESSIONAL, SCIENTIFIC AND TECHNICAL ACTIVITIES",0.27827754616737366,1
openalex,RFID technology advancements,52,"Warehousing, storage and support activities for transportation",H,TRANSPORTATION AND STORAGE,0.38119661808013916,1
openalex,Microfinance and Financial Inclusion,64,"Financial service activities, except insurance and pension funding",L,FINANCIAL AND INSURANCE ACTIVITIES,0.4470198154449463,1
openalex,Advanced Fiber Laser Technologies,26,"Manufacture of computer, electronic and optical products",C,MANUFACTURING,0.42486295104026794,1
openalex,Uterine Myomas and Treatments,39,Remediation activities and other waste management service activities,E,"WATER SUPPLY; SEWERAGE, WASTE MANAGEMENT AND REMEDIATION ACTIVITIES",0.2300373613834381,1
openalex,Infection Control and Ventilation,35,"Electricity, gas, steam and air conditioning supply",D,"ELECTRICITY, GAS, STEAM AND AIR CONDITIONING SUPPLY",0.40547314286231995,1
openalex,Game Theory and Voting Systems,85,Education,Q,EDUCATION,0.32984280586242676,1
openalex,Forensic Anthropology and Bioarchaeology Studies,86,Human health activities,R,HUMAN HEALTH AND SOCIAL WORK ACTIVITIES,0.3301983177661896,1
openalex,Complement system in diseases,86,Human health activities,R,HUMAN HEALTH AND SOCIAL WORK ACTIVITIES,0.2977329194545746,1
openalex,Complement system in diseases,21,Manufacture of basic pharmaceutical products and pharmaceutical preparations,C,MANUFACTURING,0.28885823488235474,2
openalex,"Terrorism, Counterterrorism, and Political Violence",84,Public administration and defence; compulsory social security,P,PUBLIC ADMINISTRATION AND DEFENCE; COMPULSORY SOCIAL SECURITY,0.41340601444244385,1
openalex,Methane Hydrates and Related Phenomena,06,Extraction of crude petroleum and natural gas,B,MINING AND QUARRYING,0.547843337059021,1
openalex,Computational Geometry and Mesh Generation,62,"Computer programming, consultancy and related activities",K,"TELECOMMUNICATION, COMPUTER PROGRAMMING, CONSULTING, COMPUTING INFRASTRUCTURE AND OTHER INFORMATION SERVICE ACTIVITIES",0.3317469358444214,1
openalex,Ocular Surface and Contact Lens,86,Human health activities,R,HUMAN HEALTH AND SOCIAL WORK ACTIVITIES,0.31958523392677307,1
openalex,Heat Transfer and Optimization,26,"Manufacture of computer, electronic and optical products",C,MANUFACTURING,0.37290599942207336,1
openalex,Heat Transfer and Optimization,26,"Manufacture of computer, electronic and optical products",C,MANUFACTURING,0.37290599942207336,2
openalex,Organ Transplantation Techniques and Outcomes,86,Human health activities,R,HUMAN HEALTH AND SOCIAL WORK ACTIVITIES,0.261647492647171,1
openalex,Infection Control in Healthcare,86,Human health activities,R,HUMAN HEALTH AND SOCIAL WORK ACTIVITIES,0.335711270570755,1
openalex,Renin-Angiotensin System Studies,86,Human health activities,R,HUMAN HEALTH AND SOCIAL WORK ACTIVITIES,0.32855185866355896,1
openalex,Indoor Air Quality and Microbial Exposure,39,Remediation activities and other waste management service activities,E,"WATER SUPPLY; SEWERAGE, WASTE MANAGEMENT AND REMEDIATION ACTIVITIES",0.40152499079704285,1
openalex,Disability Rights and Representation,88,Social work activities without accommodation,R,HUMAN HEALTH AND SOCIAL WORK ACTIVITIES,0.41662701964378357,1
openalex,Crustacean biology and ecology,03,Fishing and aquaculture,A,"AGRICULTURE, FORESTRY AND FISHING",0.4851592183113098,1
openalex,Radiation Effects in Electronics,26,"Manufacture of computer, electronic and optical products",C,MANUFACTURING,0.48021554946899414,1
openalex,BIM and Construction Integration,41,Construction of residential and non-residential buildings,F,CONSTRUCTION,0.47597602009773254,1
openalex,Hybrid Renewable Energy Systems,35,"Electricity, gas, steam and air conditioning supply",D,"ELECTRICITY, GAS, STEAM AND AIR CONDITIONING SUPPLY",0.44708216190338135,1
openalex,Aerodynamics and Acoustics in Jet Flows,51,Air transport,H,TRANSPORTATION AND STORAGE,0.46840953826904297,1
openalex,Catalysis for Biomass Conversion,20,Manufacture of chemicals and chemical products,C,MANUFACTURING,0.4799240827560425,1
openalex,"Logic, Reasoning, and Knowledge",62,"Computer programming, consultancy and related activities",K,"TELECOMMUNICATION, COMPUTER PROGRAMMING, CONSULTING, COMPUTING INFRASTRUCTURE AND OTHER INFORMATION SERVICE ACTIVITIES",0.3940177857875824,1
openalex,Frailty in Older Adults,87,Residential care activities,R,HUMAN HEALTH AND SOCIAL WORK ACTIVITIES,0.3690788149833679,1
openalex,Gas Dynamics and Kinetic Theory,72,Scientific research and development,N,"PROFESSIONAL, SCIENTIFIC AND TECHNICAL ACTIVITIES",0.3405730724334717,1
openalex,Skin Protection and Aging,86,Human health activities,R,HUMAN HEALTH AND SOCIAL WORK ACTIVITIES,0.29856765270233154,1
openalex,Regional Economics and Spatial Analysis,70,Activities of head offices and management consultancy,N,"PROFESSIONAL, SCIENTIFIC AND TECHNICAL ACTIVITIES",0.3572321832180023,1
openalex,Regional Economics and Spatial Analysis,70,Activities of head offices and management consultancy,N,"PROFESSIONAL, SCIENTIFIC AND TECHNICAL ACTIVITIES",0.3572321832180023,2
openalex,Down syndrome and intellectual disability research,88,Social work activities without accommodation,R,HUMAN HEALTH AND SOCIAL WORK ACTIVITIES,0.35307565331459045,1
openalex,Monoclonal and Polyclonal Antibodies Research,21,Manufacture of basic pharmaceutical products and pharmaceutical preparations,C,MANUFACTURING,0.399807333946228,1
openalex,Chaos-based Image/Signal Encryption,62,"Computer programming, consultancy and related activities",K,"TELECOMMUNICATION, COMPUTER PROGRAMMING, CONSULTING, COMPUTING INFRASTRUCTURE AND OTHER INFORMATION SERVICE ACTIVITIES",0.34840166568756104,1
openalex,Lower Extremity Biomechanics and Pathologies,93,Sports activities and amusement and recreation activities,S,"ARTS, SPORTS AND RECREATION",0.22784101963043213,1
openalex,Lower Extremity Biomechanics and Pathologies,93,Sports activities and amusement and recreation activities,S,"ARTS, SPORTS AND RECREATION",0.22784101963043213,2
openalex,Image Enhancement Techniques,86,Human health activities,R,HUMAN HEALTH AND SOCIAL WORK ACTIVITIES,0.3577548861503601,1
openalex,Immune Cell Function and Interaction,86,Human health activities,R,HUMAN HEALTH AND SOCIAL WORK ACTIVITIES,0.29771894216537476,1
openalex,ECG Monitoring and Analysis,86,Human health activities,R,HUMAN HEALTH AND SOCIAL WORK ACTIVITIES,0.39820390939712524,1
openalex,Spectral Theory in Mathematical Physics,72,Scientific research and development,N,"PROFESSIONAL, SCIENTIFIC AND TECHNICAL ACTIVITIES",0.268390953540802,1
openalex,Prosthetics and Rehabilitation Robotics,86,Human health activities,R,HUMAN HEALTH AND SOCIAL WORK ACTIVITIES,0.31906047463417053,1
openalex,Prosthetics and Rehabilitation Robotics,87,Residential care activities,R,HUMAN HEALTH AND SOCIAL WORK ACTIVITIES,0.3136598765850067,2
openalex,Information Systems Theories and Implementation,63,"Computing infrastructure, data processing, hosting and other information service activities",K,"TELECOMMUNICATION, COMPUTER PROGRAMMING, CONSULTING, COMPUTING INFRASTRUCTURE AND OTHER INFORMATION SERVICE ACTIVITIES",0.5322973728179932,1
openalex,Antibiotic Use and Resistance,86,Human health activities,R,HUMAN HEALTH AND SOCIAL WORK ACTIVITIES,0.3870328366756439,1
openalex,Environmental Education and Sustainability,85,Education,Q,EDUCATION,0.4352092146873474,1
openalex,Advanced Operator Algebra Research,72,Scientific research and development,N,"PROFESSIONAL, SCIENTIFIC AND TECHNICAL ACTIVITIES",0.3270992636680603,1
openalex,Listeria monocytogenes in Food Safety,10,Manufacture of food products,C,MANUFACTURING,0.3179439902305603,1
openalex,Advanced Data Compression Techniques,61,Telecommunication,K,"TELECOMMUNICATION, COMPUTER PROGRAMMING, CONSULTING, COMPUTING INFRASTRUCTURE AND OTHER INFORMATION SERVICE ACTIVITIES",0.3059100806713104,1
openalex,Advanced Data Compression Techniques,62,"Computer programming, consultancy and related activities",K,"TELECOMMUNICATION, COMPUTER PROGRAMMING, CONSULTING, COMPUTING INFRASTRUCTURE AND OTHER INFORMATION SERVICE ACTIVITIES",0.3339560329914093,2
openalex,Advanced Data Compression Techniques,61,Telecommunication,K,"TELECOMMUNICATION, COMPUTER PROGRAMMING, CONSULTING, COMPUTING INFRASTRUCTURE AND OTHER INFORMATION SERVICE ACTIVITIES",0.3059100806713104,3
openalex,Advanced Data Compression Techniques,60,"Programming, broadcasting, news agency and other content distribution activities",J,"PUBLISHING, BROADCASTING, AND CONTENT PRODUCTION AND DISTRIBUTION ACTIVITIES",0.3050398528575897,4
openalex,Complementary and Alternative Medicine Studies,86,Human health activities,R,HUMAN HEALTH AND SOCIAL WORK ACTIVITIES,0.3446429371833801,1
openalex,Complementary and Alternative Medicine Studies,86,Human health activities,R,HUMAN HEALTH AND SOCIAL WORK ACTIVITIES,0.3446429371833801,2
openalex,Porphyrin and Phthalocyanine Chemistry,20,Manufacture of chemicals and chemical products,C,MANUFACTURING,0.428471177816391,1
openalex,Embedded Systems Design Techniques,26,"Manufacture of computer, electronic and optical products",C,MANUFACTURING,0.4347479045391083,1
openalex,Solar Thermal and Photovoltaic Systems,35,"Electricity, gas, steam and air conditioning supply",D,"ELECTRICITY, GAS, STEAM AND AIR CONDITIONING SUPPLY",0.4556598961353302,1
openalex,AI-based Problem Solving and Planning,62,"Computer programming, consultancy and related activities",K,"TELECOMMUNICATION, COMPUTER PROGRAMMING, CONSULTING, COMPUTING INFRASTRUCTURE AND OTHER INFORMATION SERVICE ACTIVITIES",0.3047753870487213,1
openalex,International Student and Expatriate Challenges,85,Education,Q,EDUCATION,0.46417510509490967,1
openalex,Analytical Chemistry and Chromatography,20,Manufacture of chemicals and chemical products,C,MANUFACTURING,0.4597077965736389,1
openalex,Edible Oils Quality and Analysis,20,Manufacture of chemicals and chemical products,C,MANUFACTURING,0.3872578740119934,1
openalex,Edible Oils Quality and Analysis,06,Extraction of crude petroleum and natural gas,B,MINING AND QUARRYING,0.3839830160140991,2
openalex,Corporate Governance and Management,70,Activities of head offices and management consultancy,N,"PROFESSIONAL, SCIENTIFIC AND TECHNICAL ACTIVITIES",0.5680127143859863,1
openalex,Chemical Synthesis and Analysis,20,Manufacture of chemicals and chemical products,C,MANUFACTURING,0.43795210123062134,1
openalex,Chemical Synthesis and Analysis,20,Manufacture of chemicals and chemical products,C,MANUFACTURING,0.43795210123062134,2
openalex,Telemedicine and Telehealth Implementation,61,Telecommunication,K,"TELECOMMUNICATION, COMPUTER PROGRAMMING, CONSULTING, COMPUTING INFRASTRUCTURE AND OTHER INFORMATION SERVICE ACTIVITIES",0.3862071931362152,1
openalex,Telemedicine and Telehealth Implementation,61,Telecommunication,K,"TELECOMMUNICATION, COMPUTER PROGRAMMING, CONSULTING, COMPUTING INFRASTRUCTURE AND OTHER INFORMATION SERVICE ACTIVITIES",0.3862071931362152,2
openalex,Molecular Junctions and Nanostructures,26,"Manufacture of computer, electronic and optical products",C,MANUFACTURING,0.5092347264289856,1
openalex,Tactile and Sensory Interactions,86,Human health activities,R,HUMAN HEALTH AND SOCIAL WORK ACTIVITIES,0.3096221089363098,1
openalex,Tactile and Sensory Interactions,86,Human health activities,R,HUMAN HEALTH AND SOCIAL WORK ACTIVITIES,0.3096221089363098,2
openalex,Tactile and Sensory Interactions,26,"Manufacture of computer, electronic and optical products",C,MANUFACTURING,0.3094857335090637,3
openalex,Tactile and Sensory Interactions,13,Manufacture of textiles,C,MANUFACTURING,0.3016592264175415,4
openalex,Trace Elements in Health,24,Manufacture of basic metals,C,MANUFACTURING,0.3144606053829193,1
openalex,Surgical Simulation and Training,86,Human health activities,R,HUMAN HEALTH AND SOCIAL WORK ACTIVITIES,0.39123502373695374,1
openalex,Smart Grid Security and Resilience,35,"Electricity, gas, steam and air conditioning supply",D,"ELECTRICITY, GAS, STEAM AND AIR CONDITIONING SUPPLY",0.4082843065261841,1
openalex,Memory Processes and Influences,85,Education,Q,EDUCATION,0.3871437907218933,1
openalex,Neurological disorders and treatments,86,Human health activities,R,HUMAN HEALTH AND SOCIAL WORK ACTIVITIES,0.3589760661125183,1
openalex,Advanced Drug Delivery Systems,21,Manufacture of basic pharmaceutical products and pharmaceutical preparations,C,MANUFACTURING,0.44607433676719666,1
openalex,Neutrino Physics Research,72,Scientific research and development,N,"PROFESSIONAL, SCIENTIFIC AND TECHNICAL ACTIVITIES",0.3585584759712219,1
openalex,Magnetic Properties and Synthesis of Ferrites,21,Manufacture of basic pharmaceutical products and pharmaceutical preparations,C,MANUFACTURING,0.3502979278564453,1
openalex,Force Microscopy Techniques and Applications,72,Scientific research and development,N,"PROFESSIONAL, SCIENTIFIC AND TECHNICAL ACTIVITIES",0.3393920660018921,1
openalex,Force Microscopy Techniques and Applications,72,Scientific research and development,N,"PROFESSIONAL, SCIENTIFIC AND TECHNICAL ACTIVITIES",0.3393920660018921,2
openalex,Cardiovascular Health and Disease Prevention,86,Human health activities,R,HUMAN HEALTH AND SOCIAL WORK ACTIVITIES,0.3872203230857849,1
openalex,Spinal Cord Injury Research,86,Human health activities,R,HUMAN HEALTH AND SOCIAL WORK ACTIVITIES,0.3839702010154724,1
openalex,Peripheral Artery Disease Management,86,Human health activities,R,HUMAN HEALTH AND SOCIAL WORK ACTIVITIES,0.3246184289455414,1
openalex,Access Control and Trust,62,"Computer programming, consultancy and related activities",K,"TELECOMMUNICATION, COMPUTER PROGRAMMING, CONSULTING, COMPUTING INFRASTRUCTURE AND OTHER INFORMATION SERVICE ACTIVITIES",0.3870674669742584,1
openalex,Probabilistic and Robust Engineering Design,71,Architectural and engineering activities; technical testing and analysis,N,"PROFESSIONAL, SCIENTIFIC AND TECHNICAL ACTIVITIES",0.38348424434661865,1
openalex,Wnt/β-catenin signaling in development and cancer,86,Human health activities,R,HUMAN HEALTH AND SOCIAL WORK ACTIVITIES,0.28262758255004883,1
openalex,Flood Risk Assessment and Management,36,"Water collection, treatment and supply",E,"WATER SUPPLY; SEWERAGE, WASTE MANAGEMENT AND REMEDIATION ACTIVITIES",0.4030058681964874,1
openalex,Direction-of-Arrival Estimation Techniques,61,Telecommunication,K,"TELECOMMUNICATION, COMPUTER PROGRAMMING, CONSULTING, COMPUTING INFRASTRUCTURE AND OTHER INFORMATION SERVICE ACTIVITIES",0.3379819393157959,1
openalex,Microbial Metabolic Engineering and Bioproduction,20,Manufacture of chemicals and chemical products,C,MANUFACTURING,0.35208672285079956,1
openalex,Microbial Metabolic Engineering and Bioproduction,19,Manufacture of coke and refined petroleum products,C,MANUFACTURING,0.35963720083236694,2
openalex,Microbial Metabolic Engineering and Bioproduction,20,Manufacture of chemicals and chemical products,C,MANUFACTURING,0.35208672285079956,3
openalex,Real-Time Systems Scheduling,28,Manufacture of machinery and equipment n.e.c.,C,MANUFACTURING,0.28861355781555176,1
openalex,Real-Time Systems Scheduling,26,"Manufacture of computer, electronic and optical products",C,MANUFACTURING,0.28721126914024353,2
openalex,Heat shock proteins research,86,Human health activities,R,HUMAN HEALTH AND SOCIAL WORK ACTIVITIES,0.2822219133377075,1
openalex,Heat shock proteins research,78,Employment activities,O,ADMINISTRATIVE AND SUPPORT SERVICE ACTIVITIES,0.27462324500083923,2
openalex,Endometriosis Research and Treatment,86,Human health activities,R,HUMAN HEALTH AND SOCIAL WORK ACTIVITIES,0.36169669032096863,1
openalex,Millimeter-Wave Propagation and Modeling,61,Telecommunication,K,"TELECOMMUNICATION, COMPUTER PROGRAMMING, CONSULTING, COMPUTING INFRASTRUCTURE AND OTHER INFORMATION SERVICE ACTIVITIES",0.4443926513195038,1
openalex,"Telomeres, Telomerase, and Senescence",87,Residential care activities,R,HUMAN HEALTH AND SOCIAL WORK ACTIVITIES,0.2571294605731964,1
openalex,"Telomeres, Telomerase, and Senescence",86,Human health activities,R,HUMAN HEALTH AND SOCIAL WORK ACTIVITIES,0.2530170679092407,2
openalex,Phase Change Materials Research,35,"Electricity, gas, steam and air conditioning supply",D,"ELECTRICITY, GAS, STEAM AND AIR CONDITIONING SUPPLY",0.4071311056613922,1
openalex,Crystal Structures and Properties,26,"Manufacture of computer, electronic and optical products",C,MANUFACTURING,0.37552881240844727,1
openalex,Navier-Stokes equation solutions,71,Architectural and engineering activities; technical testing and analysis,N,"PROFESSIONAL, SCIENTIFIC AND TECHNICAL ACTIVITIES",0.38715726137161255,1
