source,tag,division_code,division_name,section_code,section_name,cos,rank
openalex,Digital Accessibility for Disabilities,63,"Computing infrastructure, data processing, hosting and other information service activities",K,"TELECOMMUNICATION, COMPUTER PROGRAMMING, CONSULTING, COMPUTING INFRASTRUCTURE AND OTHER INFORMATION SERVICE ACTIVITIES",0.3608834147453308,1
openalex,Tunneling and Rock Mechanics,09,Mining support service activities,B,MINING AND QUARRYING,0.5525725483894348,1
openalex,Global Urban Networks and Dynamics,70,Activities of head offices and management consultancy,N,"PROFESSIONAL, SCIENTIFIC AND TECHNICAL ACTIVITIES",0.36701297760009766,1
openalex,Retinopathy of Prematurity Studies,86,Human health activities,R,HUMAN HEALTH AND SOCIAL WORK ACTIVITIES,0.28764063119888306,1
openalex,"Optimism, Hope, and Well-being",88,Social work activities without accommodation,R,HUMAN HEALTH AND SOCIAL WORK ACTIVITIES,0.47345829010009766,1
openalex,Food Supply Chain Traceability,52,"Warehousing, storage and support activities for transportation",H,TRANSPORTATION AND STORAGE,0.42535483837127686,1
openalex,Structural Engineering and Vibration Analysis,42,Civil engineering,F,CONSTRUCTION,0.4684445559978485,1
openalex,Mental Health via Writing,88,Social work activities without accommodation,R,HUMAN HEALTH AND SOCIAL WORK ACTIVITIES,0.4434676468372345,1
openalex,Microbial Metabolites in Food Biotechnology,10,Manufacture of food products,C,MANUFACTURING,0.383310467004776,1
openalex,Software Engineering and Design Patterns,14,Manufacture of wearing apparel,C,MANUFACTURING,0.6050474047660828,1
openalex,Superconductivity in MgB2 and Alloys,27,Manufacture of electrical equipment,C,MANUFACTURING,0.3332003057003021,1
openalex,Zoonotic diseases and public health,75,Veterinary activities,N,"PROFESSIONAL, SCIENTIFIC AND TECHNICAL ACTIVITIES",0.4570760428905487,1
openalex,"Memory, violence, and history",88,Social work activities without accommodation,R,HUMAN HEALTH AND SOCIAL WORK ACTIVITIES,0.3311193585395813,1
openalex,Alcoholism and Thiamine Deficiency,11,Manufacture of beverages,C,MANUFACTURING,0.36953726410865784,1
openalex,Electrostatic Discharge in Electronics,26,"Manufacture of computer, electronic and optical products",C,MANUFACTURING,0.4279599189758301,1
openalex,Color perception and design,73,"Activities of advertising, market research and public relations",N,"PROFESSIONAL, SCIENTIFIC AND TECHNICAL ACTIVITIES",0.41031941771507263,1
openalex,Pneumocystis jirovecii pneumonia detection and treatment,86,Human health activities,R,HUMAN HEALTH AND SOCIAL WORK ACTIVITIES,0.3306821882724762,1
openalex,Advances in Cucurbitaceae Research,01,"Crop and animal production, hunting and related service activities",A,"AGRICULTURE, FORESTRY AND FISHING",0.40100646018981934,1
openalex,Electrical Contact Performance and Analysis,27,Manufacture of electrical equipment,C,MANUFACTURING,0.397632896900177,1
openalex,Art Therapy and Mental Health,88,Social work activities without accommodation,R,HUMAN HEALTH AND SOCIAL WORK ACTIVITIES,0.39648929238319397,1
openalex,Linguistic research and analysis,73,"Activities of advertising, market research and public relations",N,"PROFESSIONAL, SCIENTIFIC AND TECHNICAL ACTIVITIES",0.4876865744590759,1
openalex,European and International Contract Law,69,Legal and accounting activities,N,"PROFESSIONAL, SCIENTIFIC AND TECHNICAL ACTIVITIES",0.36517617106437683,1
openalex,European and International Contract Law,84,Public administration and defence; compulsory social security,P,PUBLIC ADMINISTRATION AND DEFENCE; COMPULSORY SOCIAL SECURITY,0.36211612820625305,2
openalex,Cuban History and Society,88,Social work activities without accommodation,R,HUMAN HEALTH AND SOCIAL WORK ACTIVITIES,0.3146190345287323,1
openalex,Corporate Management and Leadership,70,Activities of head offices and management consultancy,N,"PROFESSIONAL, SCIENTIFIC AND TECHNICAL ACTIVITIES",0.5728775858879089,1
openalex,Digital Humanities and Scholarship,63,"Computing infrastructure, data processing, hosting and other information service activities",K,"TELECOMMUNICATION, COMPUTER PROGRAMMING, CONSULTING, COMPUTING INFRASTRUCTURE AND OTHER INFORMATION SERVICE ACTIVITIES",0.4198875427246094,1
openalex,Digital Humanities and Scholarship,91,"Libraries, archives, museums and other cultural activities",S,"ARTS, SPORTS AND RECREATION",0.4560560882091522,2
openalex,Accounting Education and Careers,85,Education,Q,EDUCATION,0.46641862392425537,1
openalex,Cancer Diagnosis and Treatment,86,Human health activities,R,HUMAN HEALTH AND SOCIAL WORK ACTIVITIES,0.3839717507362366,1
openalex,Authorship Attribution and Profiling,62,"Computer programming, consultancy and related activities",K,"TELECOMMUNICATION, COMPUTER PROGRAMMING, CONSULTING, COMPUTING INFRASTRUCTURE AND OTHER INFORMATION SERVICE ACTIVITIES",0.34462887048721313,1
openalex,Electron Spin Resonance Studies,72,Scientific research and development,N,"PROFESSIONAL, SCIENTIFIC AND TECHNICAL ACTIVITIES",0.32444992661476135,1
openalex,Electron Spin Resonance Studies,72,Scientific research and development,N,"PROFESSIONAL, SCIENTIFIC AND TECHNICAL ACTIVITIES",0.32444992661476135,2
openalex,History of Education Research in Brazil,85,Education,Q,EDUCATION,0.4472019076347351,1
openalex,History of Education Research in Brazil,91,"Libraries, archives, museums and other cultural activities",S,"ARTS, SPORTS AND RECREATION",0.4493791460990906,2
openalex,Aeolian processes and effects,09,Mining support service activities,B,MINING AND QUARRYING,0.3181488513946533,1
openalex,Customer churn and segmentation,61,Telecommunication,K,"TELECOMMUNICATION, COMPUTER PROGRAMMING, CONSULTING, COMPUTING INFRASTRUCTURE AND OTHER INFORMATION SERVICE ACTIVITIES",0.42983055114746094,1
openalex,Food Quality and Safety Studies,10,Manufacture of food products,C,MANUFACTURING,0.4701080620288849,1
openalex,Advanced X-ray and CT Imaging,72,Scientific research and development,N,"PROFESSIONAL, SCIENTIFIC AND TECHNICAL ACTIVITIES",0.3644462525844574,1
openalex,Galectins and Cancer Biology,86,Human health activities,R,HUMAN HEALTH AND SOCIAL WORK ACTIVITIES,0.27348682284355164,1
openalex,Identification and Quantification in Food,10,Manufacture of food products,C,MANUFACTURING,0.37390783429145813,1
openalex,Infrared Target Detection Methodologies,39,Remediation activities and other waste management service activities,E,"WATER SUPPLY; SEWERAGE, WASTE MANAGEMENT AND REMEDIATION ACTIVITIES",0.3248426616191864,1
openalex,Comics and Graphic Narratives,86,Human health activities,R,HUMAN HEALTH AND SOCIAL WORK ACTIVITIES,0.3578205406665802,1
openalex,Artificial Immune Systems Applications,62,"Computer programming, consultancy and related activities",K,"TELECOMMUNICATION, COMPUTER PROGRAMMING, CONSULTING, COMPUTING INFRASTRUCTURE AND OTHER INFORMATION SERVICE ACTIVITIES",0.3458707630634308,1
openalex,Sharing Economy and Platforms,55,Accommodation,I,ACCOMMODATION AND FOOD SERVICE ACTIVITIES,0.4758761525154114,1
openalex,Workplace Spirituality and Leadership,70,Activities of head offices and management consultancy,N,"PROFESSIONAL, SCIENTIFIC AND TECHNICAL ACTIVITIES",0.3584476709365845,1
openalex,Insurance and Financial Risk Management,65,"Insurance, reinsurance and pension funding, except compulsory social security",L,FINANCIAL AND INSURANCE ACTIVITIES,0.6244823932647705,1
openalex,Educational Innovations and Technology,85,Education,Q,EDUCATION,0.4821398854255676,1
openalex,Advanced Differential Equations and Dynamical Systems,72,Scientific research and development,N,"PROFESSIONAL, SCIENTIFIC AND TECHNICAL ACTIVITIES",0.33141660690307617,1
openalex,Critical Theory and Philosophy,85,Education,Q,EDUCATION,0.29800817370414734,1
openalex,Critical Theory and Philosophy,70,Activities of head offices and management consultancy,N,"PROFESSIONAL, SCIENTIFIC AND TECHNICAL ACTIVITIES",0.2946329414844513,2
openalex,Poetry Analysis and Criticism,85,Education,Q,EDUCATION,0.34379976987838745,1
openalex,Poetry Analysis and Criticism,85,Education,Q,EDUCATION,0.34379976987838745,2
openalex,Wine Industry and Tourism,79,"Travel agency, tour operator and other reservation service and related activities",O,ADMINISTRATIVE AND SUPPORT SERVICE ACTIVITIES,0.44336241483688354,1
openalex,Neurogenetic and Muscular Disorders Research,86,Human health activities,R,HUMAN HEALTH AND SOCIAL WORK ACTIVITIES,0.28262144327163696,1
openalex,Neurogenetic and Muscular Disorders Research,87,Residential care activities,R,HUMAN HEALTH AND SOCIAL WORK ACTIVITIES,0.2821982502937317,2
openalex,Scheduling and Timetabling Solutions,87,Residential care activities,R,HUMAN HEALTH AND SOCIAL WORK ACTIVITIES,0.41056162118911743,1
openalex,Travel-related health issues,86,Human health activities,R,HUMAN HEALTH AND SOCIAL WORK ACTIVITIES,0.28098824620246887,1
openalex,Travel-related health issues,86,Human health activities,R,HUMAN HEALTH AND SOCIAL WORK ACTIVITIES,0.28098824620246887,2
openalex,Seed and Plant Biochemistry,20,Manufacture of chemicals and chemical products,C,MANUFACTURING,0.2516939342021942,1
openalex,Seed and Plant Biochemistry,20,Manufacture of chemicals and chemical products,C,MANUFACTURING,0.2516939342021942,2
openalex,Seed and Plant Biochemistry,21,Manufacture of basic pharmaceutical products and pharmaceutical preparations,C,MANUFACTURING,0.2453688383102417,3
openalex,Mathematical Approximation and Integration,62,"Computer programming, consultancy and related activities",K,"TELECOMMUNICATION, COMPUTER PROGRAMMING, CONSULTING, COMPUTING INFRASTRUCTURE AND OTHER INFORMATION SERVICE ACTIVITIES",0.39465445280075073,1
openalex,Mathematical Approximation and Integration,72,Scientific research and development,N,"PROFESSIONAL, SCIENTIFIC AND TECHNICAL ACTIVITIES",0.43339788913726807,2
openalex,Characterization and Applications of Magnetic Nanoparticles,86,Human health activities,R,HUMAN HEALTH AND SOCIAL WORK ACTIVITIES,0.3209420144557953,1
openalex,Characterization and Applications of Magnetic Nanoparticles,86,Human health activities,R,HUMAN HEALTH AND SOCIAL WORK ACTIVITIES,0.3209420144557953,2
openalex,IoT and GPS-based Vehicle Safety Systems,45,Trade and repair of motor vehicles and motorcycles,G,WHOLESALE AND RETAIL TRADE,0.3668713867664337,1
openalex,IoT and GPS-based Vehicle Safety Systems,49,Land transport and transport via pipelines,H,TRANSPORTATION AND STORAGE,0.3671920895576477,2
openalex,IoT and GPS-based Vehicle Safety Systems,45,Trade and repair of motor vehicles and motorcycles,G,WHOLESALE AND RETAIL TRADE,0.3668713867664337,3
openalex,IoT and GPS-based Vehicle Safety Systems,95,"Repair and maintenance of computers, personal and household goods, and motor vehicles and motorcycles",T,OTHER SERVICE ACTIVITIES,0.3603135347366333,4
openalex,Plant Growth Enhancement Techniques,01,"Crop and animal production, hunting and related service activities",A,"AGRICULTURE, FORESTRY AND FISHING",0.39748141169548035,1
openalex,Educational Innovations and Challenges,85,Education,Q,EDUCATION,0.47086983919143677,1
openalex,Reformation and Early Modern Christianity,85,Education,Q,EDUCATION,0.277785062789917,1
openalex,Structural and Chemical Analysis of Organic and Inorganic Compounds,20,Manufacture of chemicals and chemical products,C,MANUFACTURING,0.45304951071739197,1
openalex,Shoulder and Clavicle Injuries,86,Human health activities,R,HUMAN HEALTH AND SOCIAL WORK ACTIVITIES,0.3459100127220154,1
openalex,Enzyme function and inhibition,21,Manufacture of basic pharmaceutical products and pharmaceutical preparations,C,MANUFACTURING,0.4180489480495453,1
openalex,Health and Medical Education,86,Human health activities,R,HUMAN HEALTH AND SOCIAL WORK ACTIVITIES,0.4541085958480835,1
openalex,Coastal and Marine Management,03,Fishing and aquaculture,A,"AGRICULTURE, FORESTRY AND FISHING",0.47952136397361755,1
openalex,Employer Branding and e-HRM,78,Employment activities,O,ADMINISTRATIVE AND SUPPORT SERVICE ACTIVITIES,0.4614039361476898,1
openalex,Polymer Nanocomposite Synthesis and Irradiation,22,Manufacture of rubber and plastic products,C,MANUFACTURING,0.5046560764312744,1
openalex,Morphological variations and asymmetry,72,Scientific research and development,N,"PROFESSIONAL, SCIENTIFIC AND TECHNICAL ACTIVITIES",0.24011656641960144,1
openalex,Respiratory and Cough-Related Research,86,Human health activities,R,HUMAN HEALTH AND SOCIAL WORK ACTIVITIES,0.3962212800979614,1
openalex,Phonocardiography and Auscultation Techniques,86,Human health activities,R,HUMAN HEALTH AND SOCIAL WORK ACTIVITIES,0.39074456691741943,1
openalex,Silicone and Siloxane Chemistry,20,Manufacture of chemicals and chemical products,C,MANUFACTURING,0.4214628040790558,1
openalex,Silicone and Siloxane Chemistry,20,Manufacture of chemicals and chemical products,C,MANUFACTURING,0.4214628040790558,2
openalex,Adrenal Hormones and Disorders,86,Human health activities,R,HUMAN HEALTH AND SOCIAL WORK ACTIVITIES,0.3018319606781006,1
openalex,Adrenal Hormones and Disorders,88,Social work activities without accommodation,R,HUMAN HEALTH AND SOCIAL WORK ACTIVITIES,0.2958483099937439,2
openalex,Radiomics and Machine Learning in Medical Imaging,86,Human health activities,R,HUMAN HEALTH AND SOCIAL WORK ACTIVITIES,0.37504446506500244,1
openalex,Software Reliability and Analysis Research,72,Scientific research and development,N,"PROFESSIONAL, SCIENTIFIC AND TECHNICAL ACTIVITIES",0.3906932473182678,1
openalex,Software Reliability and Analysis Research,72,Scientific research and development,N,"PROFESSIONAL, SCIENTIFIC AND TECHNICAL ACTIVITIES",0.3906932473182678,2
openalex,Earthquake Detection and Analysis,09,Mining support service activities,B,MINING AND QUARRYING,0.3469013571739197,1
openalex,Industrial Gas Emission Control,39,Remediation activities and other waste management service activities,E,"WATER SUPPLY; SEWERAGE, WASTE MANAGEMENT AND REMEDIATION ACTIVITIES",0.4823147654533386,1
openalex,Lymphatic Disorders and Treatments,86,Human health activities,R,HUMAN HEALTH AND SOCIAL WORK ACTIVITIES,0.34691813588142395,1
openalex,Metal Alloys Wear and Properties,25,"Manufacture of fabricated metal products, except machinery and equipment",C,MANUFACTURING,0.4194273054599762,1
openalex,Metal Alloys Wear and Properties,32,Other manufacturing,C,MANUFACTURING,0.42195749282836914,2
openalex,Metal Alloys Wear and Properties,25,"Manufacture of fabricated metal products, except machinery and equipment",C,MANUFACTURING,0.4194273054599762,3
openalex,Global Trade and Competitiveness,70,Activities of head offices and management consultancy,N,"PROFESSIONAL, SCIENTIFIC AND TECHNICAL ACTIVITIES",0.45144492387771606,1
openalex,Chemotherapy-induced organ toxicity mitigation,21,Manufacture of basic pharmaceutical products and pharmaceutical preparations,C,MANUFACTURING,0.32247093319892883,1
openalex,Chemotherapy-induced organ toxicity mitigation,86,Human health activities,R,HUMAN HEALTH AND SOCIAL WORK ACTIVITIES,0.3134665787220001,2
openalex,Academic and Historical Perspectives in Psychology,85,Education,Q,EDUCATION,0.42096251249313354,1
openalex,Sugarcane Cultivation and Processing,01,"Crop and animal production, hunting and related service activities",A,"AGRICULTURE, FORESTRY AND FISHING",0.4394480884075165,1
openalex,Arctic and Russian Policy Studies,06,Extraction of crude petroleum and natural gas,B,MINING AND QUARRYING,0.49237990379333496,1
openalex,Marine Toxins and Detection Methods,03,Fishing and aquaculture,A,"AGRICULTURE, FORESTRY AND FISHING",0.4495023488998413,1
openalex,Scientific Computing and Data Management,63,"Computing infrastructure, data processing, hosting and other information service activities",K,"TELECOMMUNICATION, COMPUTER PROGRAMMING, CONSULTING, COMPUTING INFRASTRUCTURE AND OTHER INFORMATION SERVICE ACTIVITIES",0.5599937438964844,1
openalex,COVID-19 Impact on Reproduction,86,Human health activities,R,HUMAN HEALTH AND SOCIAL WORK ACTIVITIES,0.2130068689584732,1
openalex,COVID-19 Impact on Reproduction,75,Veterinary activities,N,"PROFESSIONAL, SCIENTIFIC AND TECHNICAL ACTIVITIES",0.2179451733827591,2
openalex,COVID-19 Impact on Reproduction,86,Human health activities,R,HUMAN HEALTH AND SOCIAL WORK ACTIVITIES,0.2130068689584732,3
openalex,Sustainable Building Design and Assessment,41,Construction of residential and non-residential buildings,F,CONSTRUCTION,0.4453791081905365,1
openalex,Oxidative Organic Chemistry Reactions,20,Manufacture of chemicals and chemical products,C,MANUFACTURING,0.46397095918655396,1
openalex,Global Health Workforce Issues,86,Human health activities,R,HUMAN HEALTH AND SOCIAL WORK ACTIVITIES,0.34432971477508545,1
openalex,Global Health Workforce Issues,86,Human health activities,R,HUMAN HEALTH AND SOCIAL WORK ACTIVITIES,0.34432971477508545,2
openalex,Global Health Workforce Issues,88,Social work activities without accommodation,R,HUMAN HEALTH AND SOCIAL WORK ACTIVITIES,0.3429175913333893,3
openalex,Global Health Workforce Issues,87,Residential care activities,R,HUMAN HEALTH AND SOCIAL WORK ACTIVITIES,0.33979231119155884,4
openalex,Soft tissue tumor case studies,86,Human health activities,R,HUMAN HEALTH AND SOCIAL WORK ACTIVITIES,0.3233809471130371,1
openalex,CCD and CMOS Imaging Sensors,26,"Manufacture of computer, electronic and optical products",C,MANUFACTURING,0.48004382848739624,1
openalex,Atomic and Subatomic Physics Research,72,Scientific research and development,N,"PROFESSIONAL, SCIENTIFIC AND TECHNICAL ACTIVITIES",0.37568023800849915,1
openalex,Human Resource Development and Performance Evaluation,78,Employment activities,O,ADMINISTRATIVE AND SUPPORT SERVICE ACTIVITIES,0.43504494428634644,1
openalex,"FinTech, Crowdfunding, Digital Finance",64,"Financial service activities, except insurance and pension funding",L,FINANCIAL AND INSURANCE ACTIVITIES,0.4387917220592499,1
openalex,Random lasers and scattering media,72,Scientific research and development,N,"PROFESSIONAL, SCIENTIFIC AND TECHNICAL ACTIVITIES",0.33117344975471497,1
openalex,Free Will and Agency,70,Activities of head offices and management consultancy,N,"PROFESSIONAL, SCIENTIFIC AND TECHNICAL ACTIVITIES",0.36034509539604187,1
openalex,Youth Development and Social Support,88,Social work activities without accommodation,R,HUMAN HEALTH AND SOCIAL WORK ACTIVITIES,0.39939042925834656,1
openalex,Empathy and Medical Education,85,Education,Q,EDUCATION,0.4059942960739136,1
openalex,Systems Engineering Methodologies and Applications,71,Architectural and engineering activities; technical testing and analysis,N,"PROFESSIONAL, SCIENTIFIC AND TECHNICAL ACTIVITIES",0.4374770522117615,1
openalex,Fossil Insects in Amber,91,"Libraries, archives, museums and other cultural activities",S,"ARTS, SPORTS AND RECREATION",0.32935085892677307,1
openalex,"Computability, Logic, AI Algorithms",62,"Computer programming, consultancy and related activities",K,"TELECOMMUNICATION, COMPUTER PROGRAMMING, CONSULTING, COMPUTING INFRASTRUCTURE AND OTHER INFORMATION SERVICE ACTIVITIES",0.44177258014678955,1
openalex,Bioenergy crop production and management,01,"Crop and animal production, hunting and related service activities",A,"AGRICULTURE, FORESTRY AND FISHING",0.4672796130180359,1
openalex,Advanced Frequency and Time Standards,61,Telecommunication,K,"TELECOMMUNICATION, COMPUTER PROGRAMMING, CONSULTING, COMPUTING INFRASTRUCTURE AND OTHER INFORMATION SERVICE ACTIVITIES",0.3096168339252472,1
openalex,Advanced Frequency and Time Standards,99,Activities of extraterritorial organisations and bodies,V,ACTIVITIES OF EXTRATERRITORIAL ORGANISATIONS AND BODIES,0.3358335793018341,2
openalex,Spaceflight effects on biology,86,Human health activities,R,HUMAN HEALTH AND SOCIAL WORK ACTIVITIES,0.2881188690662384,1
openalex,Ergonomics and Musculoskeletal Disorders,26,"Manufacture of computer, electronic and optical products",C,MANUFACTURING,0.3586867153644562,1
openalex,Plasma and Flow Control in Aerodynamics,51,Air transport,H,TRANSPORTATION AND STORAGE,0.31490659713745117,1
openalex,Solar-Powered Water Purification Methods,36,"Water collection, treatment and supply",E,"WATER SUPPLY; SEWERAGE, WASTE MANAGEMENT AND REMEDIATION ACTIVITIES",0.5367215275764465,1
openalex,Hedgehog Signaling Pathway Studies,86,Human health activities,R,HUMAN HEALTH AND SOCIAL WORK ACTIVITIES,0.32823970913887024,1
openalex,Evaluation and Performance Assessment,70,Activities of head offices and management consultancy,N,"PROFESSIONAL, SCIENTIFIC AND TECHNICAL ACTIVITIES",0.4243795573711395,1
openalex,"Insurance, Mortality, Demography, Risk Management",65,"Insurance, reinsurance and pension funding, except compulsory social security",L,FINANCIAL AND INSURANCE ACTIVITIES,0.5652838945388794,1
openalex,Diatoms and Algae Research,72,Scientific research and development,N,"PROFESSIONAL, SCIENTIFIC AND TECHNICAL ACTIVITIES",0.35986068844795227,1
openalex,Diatoms and Algae Research,72,Scientific research and development,N,"PROFESSIONAL, SCIENTIFIC AND TECHNICAL ACTIVITIES",0.35986068844795227,2
openalex,Sustainable Development and Environmental Policy,70,Activities of head offices and management consultancy,N,"PROFESSIONAL, SCIENTIFIC AND TECHNICAL ACTIVITIES",0.4460795521736145,1
openalex,"Fish biology, ecology, and behavior",03,Fishing and aquaculture,A,"AGRICULTURE, FORESTRY AND FISHING",0.46634089946746826,1
openalex,Photoacoustic and Ultrasonic Imaging,86,Human health activities,R,HUMAN HEALTH AND SOCIAL WORK ACTIVITIES,0.38132444024086,1
openalex,Web Data Mining and Analysis,63,"Computing infrastructure, data processing, hosting and other information service activities",K,"TELECOMMUNICATION, COMPUTER PROGRAMMING, CONSULTING, COMPUTING INFRASTRUCTURE AND OTHER INFORMATION SERVICE ACTIVITIES",0.3446481227874756,1
openalex,Web Data Mining and Analysis,05,Mining of coal and lignite,B,MINING AND QUARRYING,0.3523062467575073,2
openalex,Web Data Mining and Analysis,63,"Computing infrastructure, data processing, hosting and other information service activities",K,"TELECOMMUNICATION, COMPUTER PROGRAMMING, CONSULTING, COMPUTING INFRASTRUCTURE AND OTHER INFORMATION SERVICE ACTIVITIES",0.3446481227874756,3
openalex,Recycling and Waste Management Techniques,38,"Waste collection, recovery and disposal activities",E,"WATER SUPPLY; SEWERAGE, WASTE MANAGEMENT AND REMEDIATION ACTIVITIES",0.622687578201294,1
openalex,Coronary Artery Anomalies,86,Human health activities,R,HUMAN HEALTH AND SOCIAL WORK ACTIVITIES,0.3199334442615509,1
openalex,Calibration and Measurement Techniques,74,"Other professional, scientific and technical activities",N,"PROFESSIONAL, SCIENTIFIC AND TECHNICAL ACTIVITIES",0.27907833456993103,1
openalex,Calibration and Measurement Techniques,39,Remediation activities and other waste management service activities,E,"WATER SUPPLY; SEWERAGE, WASTE MANAGEMENT AND REMEDIATION ACTIVITIES",0.3114495575428009,2
openalex,Enhanced Recovery After Surgery,86,Human health activities,R,HUMAN HEALTH AND SOCIAL WORK ACTIVITIES,0.3307604491710663,1
openalex,Social and Educational Sciences,85,Education,Q,EDUCATION,0.5717115998268127,1
openalex,Hydraulic flow and structures,42,Civil engineering,F,CONSTRUCTION,0.3876960873603821,1
openalex,Hydraulic flow and structures,42,Civil engineering,F,CONSTRUCTION,0.3876960873603821,2
openalex,Cholinesterase and Neurodegenerative Diseases,21,Manufacture of basic pharmaceutical products and pharmaceutical preparations,C,MANUFACTURING,0.38793230056762695,1
openalex,Ultra-Wideband Communications Technology,61,Telecommunication,K,"TELECOMMUNICATION, COMPUTER PROGRAMMING, CONSULTING, COMPUTING INFRASTRUCTURE AND OTHER INFORMATION SERVICE ACTIVITIES",0.3948323428630829,1
openalex,Hepatitis Viruses Studies and Epidemiology,75,Veterinary activities,N,"PROFESSIONAL, SCIENTIFIC AND TECHNICAL ACTIVITIES",0.3567085564136505,1
openalex,Explainable Artificial Intelligence (XAI),70,Activities of head offices and management consultancy,N,"PROFESSIONAL, SCIENTIFIC AND TECHNICAL ACTIVITIES",0.4605901837348938,1
openalex,Social Media in Health Education,73,"Activities of advertising, market research and public relations",N,"PROFESSIONAL, SCIENTIFIC AND TECHNICAL ACTIVITIES",0.4403037428855896,1
openalex,Knowledge Management and Sharing,63,"Computing infrastructure, data processing, hosting and other information service activities",K,"TELECOMMUNICATION, COMPUTER PROGRAMMING, CONSULTING, COMPUTING INFRASTRUCTURE AND OTHER INFORMATION SERVICE ACTIVITIES",0.3456661105155945,1
openalex,DNA and Biological Computing,63,"Computing infrastructure, data processing, hosting and other information service activities",K,"TELECOMMUNICATION, COMPUTER PROGRAMMING, CONSULTING, COMPUTING INFRASTRUCTURE AND OTHER INFORMATION SERVICE ACTIVITIES",0.3522805869579315,1
openalex,DNA and Biological Computing,62,"Computer programming, consultancy and related activities",K,"TELECOMMUNICATION, COMPUTER PROGRAMMING, CONSULTING, COMPUTING INFRASTRUCTURE AND OTHER INFORMATION SERVICE ACTIVITIES",0.3450358211994171,2
openalex,S100 Proteins and Annexins,86,Human health activities,R,HUMAN HEALTH AND SOCIAL WORK ACTIVITIES,0.2570151388645172,1
openalex,S100 Proteins and Annexins,72,Scientific research and development,N,"PROFESSIONAL, SCIENTIFIC AND TECHNICAL ACTIVITIES",0.2812310457229614,2
openalex,Speech and dialogue systems,62,"Computer programming, consultancy and related activities",K,"TELECOMMUNICATION, COMPUTER PROGRAMMING, CONSULTING, COMPUTING INFRASTRUCTURE AND OTHER INFORMATION SERVICE ACTIVITIES",0.27710577845573425,1
openalex,Speech and dialogue systems,62,"Computer programming, consultancy and related activities",K,"TELECOMMUNICATION, COMPUTER PROGRAMMING, CONSULTING, COMPUTING INFRASTRUCTURE AND OTHER INFORMATION SERVICE ACTIVITIES",0.27710577845573425,2
openalex,Speech and dialogue systems,61,Telecommunication,K,"TELECOMMUNICATION, COMPUTER PROGRAMMING, CONSULTING, COMPUTING INFRASTRUCTURE AND OTHER INFORMATION SERVICE ACTIVITIES",0.27583229541778564,3
