source,tag,division_code,division_name,section_code,section_name,cos,rank
openalex,Synthesis and Reactivity of Heterocycles,20,Manufacture of chemicals and chemical products,C,MANUFACTURING,0.4282654821872711,1
openalex,Synthesis and Reactivity of Heterocycles,21,Manufacture of basic pharmaceutical products and pharmaceutical preparations,C,MANUFACTURING,0.4169699251651764,2
openalex,"History, Culture, and Diplomacy",91,"Libraries, archives, museums and other cultural activities",S,"ARTS, SPORTS AND RECREATION",0.5692700147628784,1
openalex,Laser-Ablation Synthesis of Nanoparticles,20,Manufacture of chemicals and chemical products,C,MANUFACTURING,0.3315016031265259,1
openalex,Occupational Health and Safety Management,70,Activities of head offices and management consultancy,N,"PROFESSIONAL, SCIENTIFIC AND TECHNICAL ACTIVITIES",0.4231971502304077,1
openalex,Occupational Health and Safety Management,70,Activities of head offices and management consultancy,N,"PROFESSIONAL, SCIENTIFIC AND TECHNICAL ACTIVITIES",0.4231971502304077,2
openalex,advanced mathematical theories,72,Scientific research and development,N,"PROFESSIONAL, SCIENTIFIC AND TECHNICAL ACTIVITIES",0.41279137134552,1
openalex,Management Theory and Practice,70,Activities of head offices and management consultancy,N,"PROFESSIONAL, SCIENTIFIC AND TECHNICAL ACTIVITIES",0.43793004751205444,1
openalex,Geotechnical and construction materials studies,42,Civil engineering,F,CONSTRUCTION,0.6012001037597656,1
openalex,Socio-economic Development and Sustainability,63,"Computing infrastructure, data processing, hosting and other information service activities",K,"TELECOMMUNICATION, COMPUTER PROGRAMMING, CONSULTING, COMPUTING INFRASTRUCTURE AND OTHER INFORMATION SERVICE ACTIVITIES",0.5213736295700073,1
openalex,Botanical Studies and Applications,86,Human health activities,R,HUMAN HEALTH AND SOCIAL WORK ACTIVITIES,0.3032246232032776,1
openalex,Phosphorus compounds and reactions,20,Manufacture of chemicals and chemical products,C,MANUFACTURING,0.4677935242652893,1
openalex,Bioeconomy and Sustainability Development,02,Forestry and logging,A,"AGRICULTURE, FORESTRY AND FISHING",0.5861325263977051,1
openalex,Male Reproductive Health Studies,86,Human health activities,R,HUMAN HEALTH AND SOCIAL WORK ACTIVITIES,0.37411049008369446,1
openalex,Innovation in Digital Healthcare Systems,86,Human health activities,R,HUMAN HEALTH AND SOCIAL WORK ACTIVITIES,0.382353276014328,1
openalex,Analysis of environmental and stochastic processes,36,"Water collection, treatment and supply",E,"WATER SUPPLY; SEWERAGE, WASTE MANAGEMENT AND REMEDIATION ACTIVITIES",0.49390286207199097,1
openalex,Samuel Beckett and Modernism,90,Arts creation and performing arts activities,S,"ARTS, SPORTS AND RECREATION",0.32443636655807495,1
openalex,"Agriculture, Plant Science, Crop Management",01,"Crop and animal production, hunting and related service activities",A,"AGRICULTURE, FORESTRY AND FISHING",0.5132718086242676,1
openalex,Local Governance and Planning,84,Public administration and defence; compulsory social security,P,PUBLIC ADMINISTRATION AND DEFENCE; COMPULSORY SOCIAL SECURITY,0.39429938793182373,1
openalex,Healthcare Technology and Patient Monitoring,87,Residential care activities,R,HUMAN HEALTH AND SOCIAL WORK ACTIVITIES,0.305778831243515,1
openalex,Dielectric properties of ceramics,27,Manufacture of electrical equipment,C,MANUFACTURING,0.3180634081363678,1
openalex,Semiotics and Representation Studies,73,"Activities of advertising, market research and public relations",N,"PROFESSIONAL, SCIENTIFIC AND TECHNICAL ACTIVITIES",0.476927787065506,1
openalex,Electrical and Thermal Properties of Materials,27,Manufacture of electrical equipment,C,MANUFACTURING,0.39128294587135315,1
openalex,Electrical and Thermal Properties of Materials,27,Manufacture of electrical equipment,C,MANUFACTURING,0.39128294587135315,2
openalex,Sex and Gender in Healthcare,86,Human health activities,R,HUMAN HEALTH AND SOCIAL WORK ACTIVITIES,0.37846335768699646,1
openalex,Chemical Reactions and Mechanisms,20,Manufacture of chemicals and chemical products,C,MANUFACTURING,0.5235539674758911,1
openalex,Macrophage Migration Inhibitory Factor,86,Human health activities,R,HUMAN HEALTH AND SOCIAL WORK ACTIVITIES,0.24865314364433289,1
openalex,"Business, Innovation, and Economy",70,Activities of head offices and management consultancy,N,"PROFESSIONAL, SCIENTIFIC AND TECHNICAL ACTIVITIES",0.512807309627533,1
openalex,Archaeology and Rock Art Studies,91,"Libraries, archives, museums and other cultural activities",S,"ARTS, SPORTS AND RECREATION",0.5722019076347351,1
openalex,Advanced Control and Stabilization in Aerospace Systems,51,Air transport,H,TRANSPORTATION AND STORAGE,0.4024696350097656,1
openalex,Williams Syndrome Research,88,Social work activities without accommodation,R,HUMAN HEALTH AND SOCIAL WORK ACTIVITIES,0.2838633358478546,1
openalex,American Jewish Fiction Analysis,91,"Libraries, archives, museums and other cultural activities",S,"ARTS, SPORTS AND RECREATION",0.2767848074436188,1
openalex,American Jewish Fiction Analysis,91,"Libraries, archives, museums and other cultural activities",S,"ARTS, SPORTS AND RECREATION",0.2767848074436188,2
openalex,Linguistics and Language Studies,85,Education,Q,EDUCATION,0.45917370915412903,1
openalex,Elasticity and Wave Propagation,22,Manufacture of rubber and plastic products,C,MANUFACTURING,0.42609745264053345,1
openalex,Semiotics and Cultural Interpretation,88,Social work activities without accommodation,R,HUMAN HEALTH AND SOCIAL WORK ACTIVITIES,0.49429693818092346,1
openalex,Building energy efficiency and sustainability,41,Construction of residential and non-residential buildings,F,CONSTRUCTION,0.5684776306152344,1
openalex,Walter Benjamin Studies Compilation,91,"Libraries, archives, museums and other cultural activities",S,"ARTS, SPORTS AND RECREATION",0.39812400937080383,1
openalex,Synthesis of Tetrazole Derivatives,21,Manufacture of basic pharmaceutical products and pharmaceutical preparations,C,MANUFACTURING,0.4644765853881836,1
openalex,Indigenous Studies in Latin America,85,Education,Q,EDUCATION,0.2981956899166107,1
openalex,Medicinal Plants and Bioactive Compounds,21,Manufacture of basic pharmaceutical products and pharmaceutical preparations,C,MANUFACTURING,0.41402682662010193,1
openalex,Education and Social Development in Ukraine,85,Education,Q,EDUCATION,0.48556628823280334,1
openalex,"Commonwealth, Australian Politics and Federalism",84,Public administration and defence; compulsory social security,P,PUBLIC ADMINISTRATION AND DEFENCE; COMPULSORY SOCIAL SECURITY,0.45116564631462097,1
openalex,Urban Planning and Landscape Design,81,Services to buildings and landscape activities,O,ADMINISTRATIVE AND SUPPORT SERVICE ACTIVITIES,0.36550313234329224,1
openalex,Urban Planning and Landscape Design,81,Services to buildings and landscape activities,O,ADMINISTRATIVE AND SUPPORT SERVICE ACTIVITIES,0.36550313234329224,2
openalex,Canadian Policy and Governance,84,Public administration and defence; compulsory social security,P,PUBLIC ADMINISTRATION AND DEFENCE; COMPULSORY SOCIAL SECURITY,0.4848959147930145,1
openalex,"Science, Research, and Medicine",86,Human health activities,R,HUMAN HEALTH AND SOCIAL WORK ACTIVITIES,0.5075331330299377,1
openalex,Aortic Thrombus and Embolism,86,Human health activities,R,HUMAN HEALTH AND SOCIAL WORK ACTIVITIES,0.3283989131450653,1
openalex,Education and Professional Development,85,Education,Q,EDUCATION,0.5398362278938293,1
openalex,Ombudsman and Human Rights,88,Social work activities without accommodation,R,HUMAN HEALTH AND SOCIAL WORK ACTIVITIES,0.4252189099788666,1
openalex,Ombudsman and Human Rights,88,Social work activities without accommodation,R,HUMAN HEALTH AND SOCIAL WORK ACTIVITIES,0.4252189099788666,2
openalex,Philosophical and Historical Studies,85,Education,Q,EDUCATION,0.4640999138355255,1
openalex,Reformed Theology and Governance,88,Social work activities without accommodation,R,HUMAN HEALTH AND SOCIAL WORK ACTIVITIES,0.35834363102912903,1
openalex,Qualitative research in health,86,Human health activities,R,HUMAN HEALTH AND SOCIAL WORK ACTIVITIES,0.4478772282600403,1
openalex,"Sustainability, Environment, and Optimization Algorithms",36,"Water collection, treatment and supply",E,"WATER SUPPLY; SEWERAGE, WASTE MANAGEMENT AND REMEDIATION ACTIVITIES",0.4209126830101013,1
openalex,Genome Rearrangement Algorithms,72,Scientific research and development,N,"PROFESSIONAL, SCIENTIFIC AND TECHNICAL ACTIVITIES",0.25959333777427673,1
openalex,Legal and cultural studies analysis,91,"Libraries, archives, museums and other cultural activities",S,"ARTS, SPORTS AND RECREATION",0.4247422218322754,1
openalex,Postmodernism in Literature and Education,85,Education,Q,EDUCATION,0.45105040073394775,1
openalex,French Literature and Criticism,91,"Libraries, archives, museums and other cultural activities",S,"ARTS, SPORTS AND RECREATION",0.3627769351005554,1
openalex,Agricultural and Rural Development Research,01,"Crop and animal production, hunting and related service activities",A,"AGRICULTURE, FORESTRY AND FISHING",0.5092750787734985,1
openalex,China's Global Influence and Migration,99,Activities of extraterritorial organisations and bodies,V,ACTIVITIES OF EXTRATERRITORIAL ORGANISATIONS AND BODIES,0.28745654225349426,1
openalex,Ziziphus Jujuba Studies and Applications,21,Manufacture of basic pharmaceutical products and pharmaceutical preparations,C,MANUFACTURING,0.22847333550453186,1
openalex,Philosophy and Phenomenology Studies,85,Education,Q,EDUCATION,0.31483522057533264,1
openalex,Thomas Hardy Literature Studies,91,"Libraries, archives, museums and other cultural activities",S,"ARTS, SPORTS AND RECREATION",0.31365400552749634,1
openalex,Library Science and Information,91,"Libraries, archives, museums and other cultural activities",S,"ARTS, SPORTS AND RECREATION",0.5830727815628052,1
openalex,Computer Science and Engineering,62,"Computer programming, consultancy and related activities",K,"TELECOMMUNICATION, COMPUTER PROGRAMMING, CONSULTING, COMPUTING INFRASTRUCTURE AND OTHER INFORMATION SERVICE ACTIVITIES",0.4469431936740875,1
openalex,Diffusion Coefficients in Liquids,20,Manufacture of chemicals and chemical products,C,MANUFACTURING,0.4270372986793518,1
openalex,Educational and Technological Research,85,Education,Q,EDUCATION,0.48923414945602417,1
openalex,Magnolia and Illicium research,86,Human health activities,R,HUMAN HEALTH AND SOCIAL WORK ACTIVITIES,0.27419596910476685,1
openalex,Magnolia and Illicium research,86,Human health activities,R,HUMAN HEALTH AND SOCIAL WORK ACTIVITIES,0.27419596910476685,2
openalex,Agricultural Research and Practices,01,"Crop and animal production, hunting and related service activities",A,"AGRICULTURE, FORESTRY AND FISHING",0.5357272624969482,1
openalex,Tardigrade Biology and Ecology,72,Scientific research and development,N,"PROFESSIONAL, SCIENTIFIC AND TECHNICAL ACTIVITIES",0.2698686122894287,1
openalex,Tardigrade Biology and Ecology,72,Scientific research and development,N,"PROFESSIONAL, SCIENTIFIC AND TECHNICAL ACTIVITIES",0.2698686122894287,2
openalex,Tardigrade Biology and Ecology,39,Remediation activities and other waste management service activities,E,"WATER SUPPLY; SEWERAGE, WASTE MANAGEMENT AND REMEDIATION ACTIVITIES",0.26348263025283813,3
openalex,"Education, Psychology, and Complexity Research",85,Education,Q,EDUCATION,0.49604472517967224,1
openalex,Engineering and Information Technology,62,"Computer programming, consultancy and related activities",K,"TELECOMMUNICATION, COMPUTER PROGRAMMING, CONSULTING, COMPUTING INFRASTRUCTURE AND OTHER INFORMATION SERVICE ACTIVITIES",0.5528669357299805,1
openalex,Engineering Education and Pedagogy,85,Education,Q,EDUCATION,0.45736008882522583,1
openalex,"Architecture, Art, Education",90,Arts creation and performing arts activities,S,"ARTS, SPORTS AND RECREATION",0.4244580864906311,1
openalex,"Architecture, Art, Education",90,Arts creation and performing arts activities,S,"ARTS, SPORTS AND RECREATION",0.4244580864906311,2
openalex,Political Dynamics in Latin America,84,Public administration and defence; compulsory social security,P,PUBLIC ADMINISTRATION AND DEFENCE; COMPULSORY SOCIAL SECURITY,0.368234246969223,1
openalex,Material Science and Thermodynamics,30,Manufacture of other transport equipment,C,MANUFACTURING,0.3743719458580017,1
openalex,Material Science and Thermodynamics,35,"Electricity, gas, steam and air conditioning supply",D,"ELECTRICITY, GAS, STEAM AND AIR CONDITIONING SUPPLY",0.36783909797668457,2
openalex,Extractivism and Socioeconomic Issues,06,Extraction of crude petroleum and natural gas,B,MINING AND QUARRYING,0.5593704581260681,1
openalex,Shallot Cultivation and Analysis,01,"Crop and animal production, hunting and related service activities",A,"AGRICULTURE, FORESTRY AND FISHING",0.368976891040802,1
openalex,Underground infrastructure and sustainability,42,Civil engineering,F,CONSTRUCTION,0.45182982087135315,1
openalex,Underground infrastructure and sustainability,43,Specialised construction activities,F,CONSTRUCTION,0.44846177101135254,2
openalex,Underground infrastructure and sustainability,09,Mining support service activities,B,MINING AND QUARRYING,0.44407761096954346,3
openalex,Quality and Safety in Healthcare,86,Human health activities,R,HUMAN HEALTH AND SOCIAL WORK ACTIVITIES,0.4016342759132385,1
openalex,Quality and Safety in Healthcare,33,"Repair, maintenance and installation of machinery and equipment",C,MANUFACTURING,0.4043431878089905,2
openalex,Quality and Safety in Healthcare,86,Human health activities,R,HUMAN HEALTH AND SOCIAL WORK ACTIVITIES,0.4016342759132385,3
openalex,"Energy, Environment, Agriculture Analysis",01,"Crop and animal production, hunting and related service activities",A,"AGRICULTURE, FORESTRY AND FISHING",0.44358786940574646,1
openalex,Italian Social Issues and Migration,88,Social work activities without accommodation,R,HUMAN HEALTH AND SOCIAL WORK ACTIVITIES,0.29792606830596924,1
openalex,Italian Social Issues and Migration,88,Social work activities without accommodation,R,HUMAN HEALTH AND SOCIAL WORK ACTIVITIES,0.29792606830596924,2
openalex,Smart Systems and Machine Learning,61,Telecommunication,K,"TELECOMMUNICATION, COMPUTER PROGRAMMING, CONSULTING, COMPUTING INFRASTRUCTURE AND OTHER INFORMATION SERVICE ACTIVITIES",0.39945584535598755,1
openalex,Immigration Law and Human Rights,84,Public administration and defence; compulsory social security,P,PUBLIC ADMINISTRATION AND DEFENCE; COMPULSORY SOCIAL SECURITY,0.41436338424682617,1
openalex,"Aging, Elder Care, and Social Issues",87,Residential care activities,R,HUMAN HEALTH AND SOCIAL WORK ACTIVITIES,0.531703531742096,1
openalex,Technology's Impact on Media,63,"Computing infrastructure, data processing, hosting and other information service activities",K,"TELECOMMUNICATION, COMPUTER PROGRAMMING, CONSULTING, COMPUTING INFRASTRUCTURE AND OTHER INFORMATION SERVICE ACTIVITIES",0.5293333530426025,1
openalex,Biliary and Gastrointestinal Fistulas,37,Sewerage,E,"WATER SUPPLY; SEWERAGE, WASTE MANAGEMENT AND REMEDIATION ACTIVITIES",0.27560651302337646,1
openalex,"Education, Politics, and Culture Studies",85,Education,Q,EDUCATION,0.5416803956031799,1
openalex,Public Spaces through Art,90,Arts creation and performing arts activities,S,"ARTS, SPORTS AND RECREATION",0.39751744270324707,1
openalex,Public Spaces through Art,91,"Libraries, archives, museums and other cultural activities",S,"ARTS, SPORTS AND RECREATION",0.4142579436302185,2
openalex,Gender Studies and Social Issues,71,Architectural and engineering activities; technical testing and analysis,N,"PROFESSIONAL, SCIENTIFIC AND TECHNICAL ACTIVITIES",0.3764142096042633,1
openalex,Psycholinguistics and Behavioral Studies,85,Education,Q,EDUCATION,0.49847376346588135,1
openalex,Machine Learning in Healthcare,86,Human health activities,R,HUMAN HEALTH AND SOCIAL WORK ACTIVITIES,0.3732537627220154,1
openalex,Attention Economy in Education and Business,85,Education,Q,EDUCATION,0.5187563300132751,1
openalex,French Literature and Poetry,91,"Libraries, archives, museums and other cultural activities",S,"ARTS, SPORTS AND RECREATION",0.5129361748695374,1
openalex,Australian Indigenous Culture and History,91,"Libraries, archives, museums and other cultural activities",S,"ARTS, SPORTS AND RECREATION",0.46630093455314636,1
openalex,Management and Optimization Techniques,70,Activities of head offices and management consultancy,N,"PROFESSIONAL, SCIENTIFIC AND TECHNICAL ACTIVITIES",0.49610012769699097,1
openalex,"Literature, Language, and Rhetoric Studies",85,Education,Q,EDUCATION,0.38607972860336304,1
openalex,"Literature, Language, and Rhetoric Studies",85,Education,Q,EDUCATION,0.38607972860336304,2
openalex,History of Emotions Research,91,"Libraries, archives, museums and other cultural activities",S,"ARTS, SPORTS AND RECREATION",0.42032739520072937,1
openalex,Education in Diverse Contexts,85,Education,Q,EDUCATION,0.5493616461753845,1
openalex,European and International Law Studies,69,Legal and accounting activities,N,"PROFESSIONAL, SCIENTIFIC AND TECHNICAL ACTIVITIES",0.42320767045021057,1
openalex,European and International Law Studies,69,Legal and accounting activities,N,"PROFESSIONAL, SCIENTIFIC AND TECHNICAL ACTIVITIES",0.42320767045021057,2
openalex,Environmental Science and Technology,72,Scientific research and development,N,"PROFESSIONAL, SCIENTIFIC AND TECHNICAL ACTIVITIES",0.37567660212516785,1
openalex,Kantian Philosophy and Modern Interpretations,85,Education,Q,EDUCATION,0.2430330067873001,1
openalex,Kantian Philosophy and Modern Interpretations,86,Human health activities,R,HUMAN HEALTH AND SOCIAL WORK ACTIVITIES,0.2429196834564209,2
openalex,Diverse Perspectives in Modern Studies,70,Activities of head offices and management consultancy,N,"PROFESSIONAL, SCIENTIFIC AND TECHNICAL ACTIVITIES",0.31929081678390503,1
openalex,Diverse Perspectives in Modern Studies,70,Activities of head offices and management consultancy,N,"PROFESSIONAL, SCIENTIFIC AND TECHNICAL ACTIVITIES",0.31929081678390503,2
openalex,Medieval Architecture and Archaeology,71,Architectural and engineering activities; technical testing and analysis,N,"PROFESSIONAL, SCIENTIFIC AND TECHNICAL ACTIVITIES",0.4121846854686737,1
openalex,Medieval Architecture and Archaeology,91,"Libraries, archives, museums and other cultural activities",S,"ARTS, SPORTS AND RECREATION",0.44733917713165283,2
openalex,Power Line Inspection Robots,35,"Electricity, gas, steam and air conditioning supply",D,"ELECTRICITY, GAS, STEAM AND AIR CONDITIONING SUPPLY",0.4096548557281494,1
openalex,Power Line Inspection Robots,27,Manufacture of electrical equipment,C,MANUFACTURING,0.4047664403915405,2
openalex,Public Administration and Political Analysis,84,Public administration and defence; compulsory social security,P,PUBLIC ADMINISTRATION AND DEFENCE; COMPULSORY SOCIAL SECURITY,0.5369954705238342,1
openalex,Historical Studies in Latin America,85,Education,Q,EDUCATION,0.3251509666442871,1
openalex,Historical Studies in Latin America,85,Education,Q,EDUCATION,0.3251509666442871,2
openalex,Vladimir Nabokov Literary Studies,85,Education,Q,EDUCATION,0.4061494767665863,1
openalex,Spanish Philosophy and Literature,90,Arts creation and performing arts activities,S,"ARTS, SPORTS AND RECREATION",0.33162665367126465,1
openalex,Spanish Philosophy and Literature,91,"Libraries, archives, museums and other cultural activities",S,"ARTS, SPORTS AND RECREATION",0.3286851644515991,2
openalex,Nanoporous metals and alloys,25,"Manufacture of fabricated metal products, except machinery and equipment",C,MANUFACTURING,0.42290207743644714,1
openalex,Nanoporous metals and alloys,32,Other manufacturing,C,MANUFACTURING,0.42589080333709717,2
openalex,Nanoporous metals and alloys,25,"Manufacture of fabricated metal products, except machinery and equipment",C,MANUFACTURING,0.42290207743644714,3
openalex,Higher Education and Sustainability,85,Education,Q,EDUCATION,0.519203782081604,1
openalex,"Graphite, nuclear technology, radiation studies",72,Scientific research and development,N,"PROFESSIONAL, SCIENTIFIC AND TECHNICAL ACTIVITIES",0.40389716625213623,1
openalex,"Graphite, nuclear technology, radiation studies",72,Scientific research and development,N,"PROFESSIONAL, SCIENTIFIC AND TECHNICAL ACTIVITIES",0.40389716625213623,2
openalex,"Graphite, nuclear technology, radiation studies",39,Remediation activities and other waste management service activities,E,"WATER SUPPLY; SEWERAGE, WASTE MANAGEMENT AND REMEDIATION ACTIVITIES",0.4037647843360901,3
openalex,Comparative Literary Analysis and Criticism,85,Education,Q,EDUCATION,0.3370383381843567,1
openalex,Comparative Literary Analysis and Criticism,85,Education,Q,EDUCATION,0.3370383381843567,2
openalex,Comparative Literary Analysis and Criticism,91,"Libraries, archives, museums and other cultural activities",S,"ARTS, SPORTS AND RECREATION",0.3377215266227722,3
openalex,Drug-Induced Ocular Toxicity,86,Human health activities,R,HUMAN HEALTH AND SOCIAL WORK ACTIVITIES,0.326626181602478,1
openalex,Educational Research and Science Teaching,85,Education,Q,EDUCATION,0.48044684529304504,1
openalex,"Environmental, Ecological, and Cultural Studies",39,Remediation activities and other waste management service activities,E,"WATER SUPPLY; SEWERAGE, WASTE MANAGEMENT AND REMEDIATION ACTIVITIES",0.4872056841850281,1
openalex,Surface Treatment and Coatings,25,"Manufacture of fabricated metal products, except machinery and equipment",C,MANUFACTURING,0.39445510506629944,1
openalex,Surface Treatment and Coatings,25,"Manufacture of fabricated metal products, except machinery and equipment",C,MANUFACTURING,0.39445510506629944,2
openalex,Surface Treatment and Coatings,24,Manufacture of basic metals,C,MANUFACTURING,0.38887935876846313,3
openalex,Cognitive Functions and Memory,87,Residential care activities,R,HUMAN HEALTH AND SOCIAL WORK ACTIVITIES,0.35148924589157104,1
openalex,Brazilian History and Foreign Policy,84,Public administration and defence; compulsory social security,P,PUBLIC ADMINISTRATION AND DEFENCE; COMPULSORY SOCIAL SECURITY,0.41738006472587585,1
openalex,Economic Zones and Regional Development,78,Employment activities,O,ADMINISTRATIVE AND SUPPORT SERVICE ACTIVITIES,0.3566313087940216,1
openalex,Economic Zones and Regional Development,78,Employment activities,O,ADMINISTRATIVE AND SUPPORT SERVICE ACTIVITIES,0.3566313087940216,2
openalex,Autobiographical and Biographical Writing,58,Publishing activities,J,"PUBLISHING, BROADCASTING, AND CONTENT PRODUCTION AND DISTRIBUTION ACTIVITIES",0.35254284739494324,1
openalex,Digital Transformation in Law,69,Legal and accounting activities,N,"PROFESSIONAL, SCIENTIFIC AND TECHNICAL ACTIVITIES",0.3738570511341095,1
openalex,Indonesian Election Politics and Participation,84,Public administration and defence; compulsory social security,P,PUBLIC ADMINISTRATION AND DEFENCE; COMPULSORY SOCIAL SECURITY,0.37477824091911316,1
openalex,Sustainable Design and Development,71,Architectural and engineering activities; technical testing and analysis,N,"PROFESSIONAL, SCIENTIFIC AND TECHNICAL ACTIVITIES",0.4260062873363495,1
openalex,Sustainable Design and Development,71,Architectural and engineering activities; technical testing and analysis,N,"PROFESSIONAL, SCIENTIFIC AND TECHNICAL ACTIVITIES",0.4260062873363495,2
openalex,Agricultural Development and Management,01,"Crop and animal production, hunting and related service activities",A,"AGRICULTURE, FORESTRY AND FISHING",0.534827470779419,1
openalex,Food Science and Nutritional Studies,10,Manufacture of food products,C,MANUFACTURING,0.23570282757282257,1
openalex,Food Science and Nutritional Studies,10,Manufacture of food products,C,MANUFACTURING,0.23570282757282257,2
openalex,Innovations and Analysis in Business and Education,70,Activities of head offices and management consultancy,N,"PROFESSIONAL, SCIENTIFIC AND TECHNICAL ACTIVITIES",0.5468207597732544,1
openalex,Neurological diseases and metabolism,86,Human health activities,R,HUMAN HEALTH AND SOCIAL WORK ACTIVITIES,0.38963156938552856,1
openalex,Engineering Education and Technology,85,Education,Q,EDUCATION,0.43643394112586975,1
openalex,Herbal Medicine Research Studies,86,Human health activities,R,HUMAN HEALTH AND SOCIAL WORK ACTIVITIES,0.29209795594215393,1
openalex,Herbal Medicine Research Studies,21,Manufacture of basic pharmaceutical products and pharmaceutical preparations,C,MANUFACTURING,0.28406718373298645,2
openalex,German History and Society,91,"Libraries, archives, museums and other cultural activities",S,"ARTS, SPORTS AND RECREATION",0.4480564296245575,1
openalex,Marine and Coastal Ecosystems,03,Fishing and aquaculture,A,"AGRICULTURE, FORESTRY AND FISHING",0.5545991063117981,1
openalex,"Literature, Magical Realism, García Márquez",91,"Libraries, archives, museums and other cultural activities",S,"ARTS, SPORTS AND RECREATION",0.3255070745944977,1
openalex,Statistical and numerical algorithms,72,Scientific research and development,N,"PROFESSIONAL, SCIENTIFIC AND TECHNICAL ACTIVITIES",0.3477722704410553,1
openalex,Sports and Physical Education Studies,93,Sports activities and amusement and recreation activities,S,"ARTS, SPORTS AND RECREATION",0.4624726474285126,1
openalex,Synthesis of β-Lactam Compounds,21,Manufacture of basic pharmaceutical products and pharmaceutical preparations,C,MANUFACTURING,0.45043066143989563,1
openalex,Aquatic Ecosystems and Biodiversity,03,Fishing and aquaculture,A,"AGRICULTURE, FORESTRY AND FISHING",0.5417340993881226,1
openalex,Social and Political Issues,88,Social work activities without accommodation,R,HUMAN HEALTH AND SOCIAL WORK ACTIVITIES,0.37938225269317627,1
openalex,Social and Political Issues,84,Public administration and defence; compulsory social security,P,PUBLIC ADMINISTRATION AND DEFENCE; COMPULSORY SOCIAL SECURITY,0.37915346026420593,2
